{"claims":{"behavioral_relevance":false,"causal_graph":false,"cross_source_total_order":false},"edges":[{"edge_id":"8478f6a5f6679739914e7e9121870379d8a72117f159f7db061822a18140d177","edge_type":"observed_dependency","event_ids":["9cbf8d90209f2723816b2f680185708a13e04a4b38365bbfaee8eb7dbfa68602"],"occurrence_count":1,"results":["present"],"source_node":"f5f0471b99d61cea9c6b869ec7443ad7b41ade4d86fb160b7aba01840113474e","source_sequences":{"ld_preload_getenv":[2]},"sources":["ld_preload_getenv"],"target_node":"b757c41538ea9146283663ff40d8b209213fce8435591aa046d0ed6506d9f698"},{"edge_id":"f6bf4fe2d40a99da8c83ffdc0f7dfb8b96f879959d11e88e22fc31eafde938dd","edge_type":"observed_dependency","event_ids":["dc283c89453c8ab1264b66b533dac4416611950d359c2e31efc4b51254083a60"],"occurrence_count":1,"results":["present"],"source_node":"f5f0471b99d61cea9c6b869ec7443ad7b41ade4d86fb160b7aba01840113474e","source_sequences":{"ld_preload_getenv":[1]},"sources":["ld_preload_getenv"],"target_node":"7ee0086e8f13cbca8be02eb599df0341bf740db08d33593d7d9e149bc304ed99"},{"edge_id":"f71421ae1d5e1752678039caa14ced9da37f1d90dbc54a63d6ea0d826d73434a","edge_type":"observed_dependency","event_ids":["88ac4fb1b71de282615c6fd9bcb9de3bcd794170cdeb40c44513c3eca4fc2b9c"],"occurrence_count":1,"results":["present"],"source_node":"f5f0471b99d61cea9c6b869ec7443ad7b41ade4d86fb160b7aba01840113474e","source_sequences":{"ld_preload_getenv":[3]},"sources":["ld_preload_getenv"],"target_node":"4503ccdfb78bb6ffe23204f8680adda28ea165cf3735d8f2a24f7de2123797a6"},{"edge_id":"0914ecd9786a9191474c1cf28c70f692b067b3dd2bb19b60fddf92266b9fac0e","edge_type":"targets_resource","source_node":"b757c41538ea9146283663ff40d8b209213fce8435591aa046d0ed6506d9f698","target_node":"158f5cf4265c400b0add3cd8e90b225ce51add4339eb38026fb28c016c76c83f"},{"edge_id":"8f9c375736a4715032e36be293b044484aaf7552fe6b2f85f65874f3814a1b61","edge_type":"targets_resource","source_node":"4503ccdfb78bb6ffe23204f8680adda28ea165cf3735d8f2a24f7de2123797a6","target_node":"09f1d2d4b3f002003b42bbd1a67b11d9531ce5532986dd4f2dddc91733d658b9"},{"edge_id":"9829427bcdb19a3a842b37fc442254dd5d99b0e1e8f4b85a36b1e28eb23306dd","edge_type":"targets_resource","source_node":"7ee0086e8f13cbca8be02eb599df0341bf740db08d33593d7d9e149bc304ed99","target_node":"0566dedd91a705d8e8e7513da7f1fcc04d9cbccc43e9a2373b1e1c38a82d4e11"}],"metrics":{"cross_source_process_nodes":0,"dependency_nodes":3,"dependency_resource_edges":3,"events_total":3,"f8_corpus_executed":false,"observed_dependency_edges":3,"parent_edges":0,"process_identity_conflicts":0,"process_nodes":1,"resource_nodes":3},"nodes":[{"dependency_key":"a69e4798a9e3bce8f507d12e59411b92c48b9a608b9bb059be57d547701615a7","kind":"environment","node_id":"4503ccdfb78bb6ffe23204f8680adda28ea165cf3735d8f2a24f7de2123797a6","node_type":"dependency","operation":"getenv","resource":"F9_UNRESOLVED","resource_type":"environment_variable"},{"dependency_key":"3ed746723a1f9595e4dfac34491ff6464bef3de2a2faa313fa6b5b95573ce397","kind":"environment","node_id":"7ee0086e8f13cbca8be02eb599df0341bf740db08d33593d7d9e149bc304ed99","node_type":"dependency","operation":"getenv","resource":"F9_RELEVANT","resource_type":"environment_variable"},{"dependency_key":"c6003b61507f82246f1db6c45d81633da167e2f45463ef244790b404dfbc70d9","kind":"environment","node_id":"b757c41538ea9146283663ff40d8b209213fce8435591aa046d0ed6506d9f698","node_type":"dependency","operation":"getenv","resource":"F9_STABLE","resource_type":"environment_variable"},{"identity_scope":"run_id_plus_pid","node_id":"f5f0471b99d61cea9c6b869ec7443ad7b41ade4d86fb160b7aba01840113474e","node_type":"process","pid":500,"ppid_values":[400],"sources":["ld_preload_getenv"]},{"node_id":"0566dedd91a705d8e8e7513da7f1fcc04d9cbccc43e9a2373b1e1c38a82d4e11","node_type":"resource","resource":"F9_RELEVANT","resource_type":"environment_variable"},{"node_id":"09f1d2d4b3f002003b42bbd1a67b11d9531ce5532986dd4f2dddc91733d658b9","node_type":"resource","resource":"F9_UNRESOLVED","resource_type":"environment_variable"},{"node_id":"158f5cf4265c400b0add3cd8e90b225ce51add4339eb38026fb28c016c76c83f","node_type":"resource","resource":"F9_STABLE","resource_type":"environment_variable"}],"run_id":"f9-5-ground-truth","schema_version":"f9.dependency_graph.v1"}
